{"indicator_type":"linear_trend","coverage_id":"finland-vap-coniferous","ebv_entity":"Coniferous","trend":{"slope":-0.45,"r_squared":0.35,"p_value":0.05},"anomalous_years":[2001,2007,2015],"interpretation":{"climate_signal":"advancing","confidence":"medium","summary":"Green-up advancing ~0.45 d/yr, consistent with spring warming."}}
